fdc_id,food_name,food_group,consumption_label,new_consumption_label,new_confidence,label_changed
174551,"Soup, chicken broth, canned, prepared with equal volume water","Soups, Sauces, and Gravies",Side Dish,Main Course,high,True
174566,"Soup, chicken broth cubes, dry, prepared with water","Soups, Sauces, and Gravies",Side Dish,Main Course,high,True
174568,"Soup, onion, dry, mix, prepared with water","Soups, Sauces, and Gravies",Side Dish,Main Course,high,True
174620,"Cereals ready-to-eat, QUAKER, QUAKER OAT CINNAMON LIFE",Breakfast Cereals,Snack,Side Dish,medium,True
174622,"Cereals ready-to-eat, QUAKER, Oatmeal Squares",Breakfast Cereals,Snack,Side Dish,medium,True
174623,"Cereals ready-to-eat, QUAKER, Oatmeal Squares, cinnamon",Breakfast Cereals,Snack,Side Dish,medium,True
174624,"Cereals, QUAKER, Instant Oatmeal, fruit and cream variety, dry",Breakfast Cereals,Snack,Side Dish,medium,True
174625,"Cereals, QUAKER, Instant Oatmeal, raisins, dates and walnuts, dry",Breakfast Cereals,Snack,Side Dish,medium,True
174626,"Cereals, QUAKER, Oat Bran, QUAKER/MOTHER'S Oat Bran, dry",Breakfast Cereals,Main Course,Side Dish,medium,True
174628,"Cereals ready-to-eat, Post, Waffle Crisp",Breakfast Cereals,Snack,Side Dish,medium,True
174632,"Cereals ready-to-eat, QUAKER, MOTHER'S Cinnamon Oat Crunch",Breakfast Cereals,Snack,Side Dish,medium,True
174634,"Cereals ready-to-eat, QUAKER, MOTHER'S COCOA BUMPERS",Breakfast Cereals,Snack,Side Dish,medium,True
174635,"Cereals ready-to-eat, SUN COUNTRY, KRETSCHMER Toasted Wheat Bran",Breakfast Cereals,Main Course,Side Dish,medium,True
174636,"Cereals, QUAKER, Instant Oatmeal, Cinnamon-Spice, dry",Breakfast Cereals,Snack,Side Dish,medium,True
174639,"Cereals ready-to-eat, UNCLE SAM CEREAL",Breakfast Cereals,Snack,Side Dish,medium,True
174644,"Cereals ready-to-eat, MOM'S BEST, Honey Nut TOASTY O'S",Breakfast Cereals,Snack,Side Dish,medium,True
174648,"Cereals ready-to-eat, RALSTON Corn Flakes",Breakfast Cereals,Snack,Side Dish,medium,True
174649,"Cereals ready-to-eat, RALSTON Crispy Hexagons",Breakfast Cereals,Snack,Side Dish,medium,True
174652,"Cereals ready-to-eat, QUAKER, Christmas Crunch",Breakfast Cereals,Snack,Side Dish,medium,True
174653,"Cereals ready-to-eat, POST SELECTS Maple Pecan Crunch",Breakfast Cereals,Snack,Side Dish,medium,True
174654,"Cereals ready-to-eat, NATURE'S PATH, Organic FLAX PLUS, Pumpkin Granola",Breakfast Cereals,Snack,Side Dish,medium,True
174656,"Incaparina, dry mix (corn and soy flours), unprepared",Breakfast Cereals,Snack,Side Dish,medium,True
174663,"Cereals ready-to-eat, POST, HONEY BUNCHES OF OATS, pecan bunches",Breakfast Cereals,Snack,Side Dish,medium,True
174670,"Fruit salad, (peach and pear and apricot and pineapple and cherry), canned, juice pack, solids and liquids",Fruits and Fruit Juices,Snack,Drink,high,True
174674,"Grapefruit, raw, pink and red, California and Arizona",Fruits and Fruit Juices,Drink,Snack,high,True
174677,"Grapefruit, raw, white, California",Fruits and Fruit Juices,Drink,Snack,high,True
174680,"Grapefruit juice, white, frozen concentrate, unsweetened, undiluted",Fruits and Fruit Juices,Snack,Drink,high,True
174684,"Grapes, canned, thompson seedless, water pack, solids and liquids",Fruits and Fruit Juices,Drink,Snack,high,True
174790,"Pretzels, soft, unsalted",Snacks,Main Course,Snack,low,True
174901,"Bagels, egg",Baked Products,Main Course,Snack,medium,True
174903,"Biscuits, plain or buttermilk, dry mix, prepared",Baked Products,Main Course,Snack,medium,True
174906,"Bread, banana, prepared from recipe, made with margarine",Baked Products,Main Course,Snack,medium,True
174907,"Bread, boston brown, canned",Baked Products,Main Course,Snack,medium,True
174910,"Bread, cornbread, prepared from recipe, made with low fat (2%) milk",Baked Products,Side Dish,Snack,medium,True
174911,"Bread, french or vienna, toasted (includes sourdough)",Baked Products,Main Course,Snack,medium,True
174912,"Bread, irish soda, prepared from recipe",Baked Products,Main Course,Snack,medium,True
174913,"Bread, Italian",Baked Products,Side Dish,Snack,medium,True
174915,"Bread, pita, white, enriched",Baked Products,Main Course,Snack,medium,True
174916,"Bread, pita, whole-wheat",Baked Products,Main Course,Side Dish,medium,True
174917,"Bread, protein (includes gluten)",Baked Products,Main Course,Snack,medium,True
174918,"Bread, pumpernickel",Baked Products,Main Course,Snack,medium,True
174919,"Bread, reduced-calorie, oatmeal",Baked Products,Main Course,Snack,medium,True
174920,"Bread, reduced-calorie, rye",Baked Products,Main Course,Snack,medium,True
174921,"Bread, reduced-calorie, wheat",Baked Products,Main Course,Side Dish,medium,True
174922,"Bread, reduced-calorie, white",Baked Products,Side Dish,Snack,medium,True
174923,"Bread, rice bran",Baked Products,Side Dish,Snack,medium,True
174926,"Bread, white, prepared from recipe, made with nonfat dry milk",Baked Products,Main Course,Snack,medium,True
174927,"Bread, white, prepared from recipe, made with low fat (2%) milk",Baked Products,Main Course,Snack,medium,True
174931,"Bread, stuffing, dry mix, prepared",Baked Products,Main Course,Snack,medium,True
174936,"Cake, coffeecake, creme-filled with chocolate frosting",Baked Products,Main Course,Snack,high,True
174937,"Cake, coffeecake, fruit",Baked Products,Main Course,Snack,high,True
174941,"Cake, shortcake, biscuit-type, prepared from recipe",Baked Products,Side Dish,Snack,high,True
174951,"Cookies, fudge, cake-type (includes trolley cakes)",Baked Products,Main Course,Snack,high,True
174981,"Crackers, rusk toast",Baked Products,Main Course,Snack,high,True
174986,"Cream puff shell, prepared from recipe",Baked Products,Main Course,Snack,medium,True
174988,"Croissants, apple",Baked Products,Main Course,Snack,medium,True
174994,"Muffins, English, plain, enriched, with ca prop (includes sourdough)",Baked Products,Main Course,Snack,medium,True
174995,"Muffins, English, plain, toasted, enriched, with calcium propionate (includes sourdough)",Baked Products,Main Course,Snack,medium,True
174996,"Muffins, English, mixed-grain (includes granola)",Baked Products,Main Course,Snack,medium,True
174998,"French toast, prepared from recipe, made with low fat (2%) milk",Baked Products,Main Course,Snack,medium,True
174999,"Hush puppies, prepared from recipe",Baked Products,Main Course,Snack,medium,True
175003,"Muffins, corn, dry mix, prepared",Baked Products,Main Course,Snack,medium,True
175004,"Muffins, corn, toaster-type",Baked Products,Main Course,Snack,medium,True
175005,"Muffins, corn, prepared from recipe, made with low fat (2%) milk",Baked Products,Side Dish,Snack,medium,True
175006,"Pancakes, plain, dry mix, complete, prepared",Baked Products,Main Course,Snack,high,True
175007,"Pancakes, plain, dry mix, incomplete (includes buttermilk)",Baked Products,Main Course,Snack,high,True
175008,"Pancakes, plain, dry mix, incomplete, prepared",Baked Products,Main Course,Snack,high,True
175009,"Pancakes, plain, prepared from recipe",Baked Products,Main Course,Snack,high,True
175010,"Pancakes, whole-wheat, dry mix, incomplete, prepared",Baked Products,Main Course,Snack,high,True
175012,"Pie, apple, prepared from recipe",Baked Products,Side Dish,Snack,medium,True
175013,"Pie, banana cream, prepared from mix, no-bake type",Baked Products,Main Course,Snack,medium,True
175015,"Pie, chocolate mousse, prepared from mix, no-bake type",Baked Products,Main Course,Snack,medium,True
175017,"Pie, coconut cream, prepared from mix, no-bake type",Baked Products,Main Course,Snack,medium,True
175018,"Pie, lemon meringue, prepared from recipe",Baked Products,Main Course,Snack,medium,True
175027,"Rolls, dinner, egg",Baked Products,Main Course,Snack,medium,True
175029,"Rolls, dinner, rye",Baked Products,Main Course,Snack,medium,True
175030,"Rolls, dinner, wheat",Baked Products,Main Course,Snack,medium,True
175031,"Rolls, hard (includes kaiser)",Baked Products,Main Course,Snack,medium,True
175033,"Sweet rolls, cheese",Baked Products,Main Course,Snack,medium,True
175039,"Waffles, plain, prepared from recipe",Baked Products,Main Course,Snack,high,True
175042,"Leavening agents, yeast, baker's, compressed",Baked Products,Main Course,Snack,medium,True
175043,"Leavening agents, yeast, baker's, active dry",Baked Products,Main Course,Snack,medium,True
175044,"Bread, rice bran, toasted",Baked Products,Side Dish,Snack,medium,True
175047,"Pancakes, buttermilk, prepared from recipe",Baked Products,Main Course,Snack,high,True
175049,"Bagels, plain, enriched, without calcium propionate (includes onion, poppy, sesame)",Baked Products,Main Course,Snack,medium,True
175050,"Bagels, plain, unenriched, with calcium propionate (includes onion, poppy, sesame)",Baked Products,Main Course,Snack,medium,True
175051,"Bagels, plain, unenriched, without calcium propionate(includes onion, poppy, sesame)",Baked Products,Main Course,Snack,medium,True
175061,"Danish pastry, raspberry, unenriched",Baked Products,Main Course,Snack,high,True
175063,"English muffins, plain, enriched, without calcium propionate(includes sourdough)",Baked Products,Main Course,Snack,medium,True
175066,"Popovers, dry mix, unenriched",Baked Products,Main Course,Snack,medium,True
175118,"Fish, herring, Atlantic, pickled",Finfish and Shellfish Products,Side Dish,Main Course,high,True
